{
  "schema_version": 1,
  "benchmark_id": "remem-code-memory",
  "benchmark_version": "v1",
  "suite": "remem-code-memory",
  "layer": "memory_system_capability",
  "conditions": [
    "remem_default"
  ],
  "schema_refs": [
    "schemas/benchmark-manifest.schema.json",
    "schemas/memory-report.schema.json",
    "schemas/memory-run.schema.json",
    "schemas/reproduction-metadata.schema.json"
  ],
  "run_artifacts": [
    "memory/artifacts/remem-code-memory-v1/remem_default-temporal-as-of-api-001/run.json",
    "memory/artifacts/remem-code-memory-v1/remem_default-stale-decision-avoidance-001/run.json",
    "memory/artifacts/remem-code-memory-v1/remem_default-conflict-detection-storage-001/run.json",
    "memory/artifacts/remem-code-memory-v1/remem_default-workstream-continuity-rename-001/run.json",
    "memory/artifacts/remem-code-memory-v1/remem_default-prior-bug-root-cause-001/run.json",
    "memory/artifacts/remem-code-memory-v1/remem_default-architecture-constraint-capture-001/run.json",
    "memory/artifacts/remem-code-memory-v1/remem_default-file-source-anchor-api-split-001/run.json",
    "memory/artifacts/remem-code-memory-v1/remem_default-user-context-relevance-001/run.json"
  ],
  "aggregate_metrics": {
    "by_category": {
      "architecture_constraints": {
        "abstention_accuracy": 1.0,
        "answer_score": 1.0,
        "citation_precision": 1.0,
        "citation_recall": 1.0,
        "forbidden_evidence_rate": 0.0,
        "staleness_accuracy": 1.0,
        "support_coverage": 1.0,
        "tasks": 1
      },
      "conflict_detection": {
        "abstention_accuracy": 1.0,
        "answer_score": 1.0,
        "citation_precision": 1.0,
        "citation_recall": 1.0,
        "forbidden_evidence_rate": 0.0,
        "staleness_accuracy": 1.0,
        "support_coverage": 1.0,
        "tasks": 1
      },
      "file_source_anchors": {
        "abstention_accuracy": 1.0,
        "answer_score": 1.0,
        "citation_precision": 1.0,
        "citation_recall": 1.0,
        "forbidden_evidence_rate": 0.0,
        "staleness_accuracy": 1.0,
        "support_coverage": 1.0,
        "tasks": 1
      },
      "prior_bug_root_cause": {
        "abstention_accuracy": 1.0,
        "answer_score": 1.0,
        "citation_precision": 1.0,
        "citation_recall": 1.0,
        "forbidden_evidence_rate": 0.0,
        "staleness_accuracy": 1.0,
        "support_coverage": 1.0,
        "tasks": 1
      },
      "stale_memory_avoidance": {
        "abstention_accuracy": 1.0,
        "answer_score": 1.0,
        "citation_precision": 1.0,
        "citation_recall": 1.0,
        "forbidden_evidence_rate": 0.0,
        "staleness_accuracy": 1.0,
        "support_coverage": 1.0,
        "tasks": 1
      },
      "temporal_as_of": {
        "abstention_accuracy": 1.0,
        "answer_score": 1.0,
        "citation_precision": 1.0,
        "citation_recall": 1.0,
        "forbidden_evidence_rate": 0.0,
        "staleness_accuracy": 1.0,
        "support_coverage": 1.0,
        "tasks": 1
      },
      "user_context_relevance": {
        "abstention_accuracy": 1.0,
        "answer_score": 1.0,
        "citation_precision": 1.0,
        "citation_recall": 1.0,
        "forbidden_evidence_rate": 0.0,
        "staleness_accuracy": 1.0,
        "support_coverage": 1.0,
        "tasks": 1
      },
      "workstream_continuity": {
        "abstention_accuracy": 1.0,
        "answer_score": 1.0,
        "citation_precision": 1.0,
        "citation_recall": 1.0,
        "forbidden_evidence_rate": 0.0,
        "staleness_accuracy": 1.0,
        "support_coverage": 1.0,
        "tasks": 1
      }
    },
    "conditions": {
      "remem_default": {
        "abstention_accuracy": 1.0,
        "answer_score": 1.0,
        "citation_precision": 1.0,
        "citation_recall": 1.0,
        "forbidden_evidence_rate": 0.0,
        "staleness_accuracy": 1.0,
        "support_coverage": 1.0,
        "tasks": 8
      }
    },
    "fixture_revision": "remem-code-memory-v1",
    "overall": {
      "abstention_accuracy": 1.0,
      "answer_score": 1.0,
      "citation_precision": 1.0,
      "citation_recall": 1.0,
      "forbidden_evidence_rate": 0.0,
      "staleness_accuracy": 1.0,
      "support_coverage": 1.0,
      "tasks": 8
    },
    "run_count": 8,
    "suite": "remem-code-memory",
    "suite_version": "v1"
  },
  "claim_level": "directional_memory_suite_no_public_claim",
  "verifier": {
    "required": true,
    "schema_version": 1
  }
}
